{
  "$schema": "./control-crosswalk.schema.json",
  "schema_version": "1.1.0",
  "catalog_version": "2026.10",
  "published_on": "2026-10-10",
  "status": "maintained_internal_crosswalk",
  "scope": {
    "en": "A minimum operational control set for selecting, piloting, operating, changing, and retiring bounded AI systems across the five playbook organization types.",
    "fr": "Un socle opérationnel minimal pour sélectionner, piloter, exploiter, modifier et retirer des systèmes IA bornés dans les cinq types d’organisation du playbook."
  },
  "limitations": {
    "en": "This crosswalk is an internal implementation aid. A listed source supports the control theme; it does not prove clause-level equivalence, certification, or legal compliance. Qualify applicable law and obtain licensed standards where required.",
    "fr": "Cette table est une aide interne à la mise en œuvre. Une source citée soutient le thème du contrôle ; elle ne prouve ni équivalence article par article, ni certification, ni conformité juridique. Qualifier le droit applicable et obtenir les normes sous licence lorsque nécessaire."
  },
  "axes": {
    "organization_types": [
      "independent",
      "tpe",
      "pme",
      "nonprofit",
      "public"
    ],
    "risk_levels": [
      "R0",
      "R1",
      "R2",
      "R3"
    ],
    "autonomy_levels": [
      "A0",
      "A1",
      "A2",
      "A3",
      "A4"
    ],
    "use_patterns": [
      "generation",
      "retrieval",
      "classification",
      "prediction",
      "conversation",
      "multimodal",
      "agentic"
    ],
    "jurisdictions": [
      "CH",
      "EU"
    ],
    "gates": [
      "G1",
      "G2",
      "G3",
      "G4",
      "G5",
      "P0",
      "P1",
      "P2",
      "P3",
      "P4",
      "P5"
    ],
    "lifecycle_phases": [
      0,
      1,
      2,
      3,
      4,
      5,
      6,
      7,
      8,
      9,
      10,
      11
    ]
  },
  "use_pattern_profiles": [
    {
      "use_pattern_id": "generation",
      "name": {
        "en": "Generation",
        "fr": "Génération"
      },
      "task": {
        "en": "Create text, code, image, audio, or another new output.",
        "fr": "Créer texte, code, image, audio ou une autre sortie nouvelle."
      },
      "evaluation_focus": [
        "accepted_quality",
        "factual_or_source_fidelity",
        "severe_content_error",
        "human_correction"
      ],
      "threat_focus": [
        "confabulation",
        "sensitive_information_disclosure",
        "intellectual_property",
        "unsafe_output_handling"
      ]
    },
    {
      "use_pattern_id": "retrieval",
      "name": {
        "en": "Retrieval",
        "fr": "Recherche augmentée"
      },
      "task": {
        "en": "Find and synthesize information from an authorized corpus.",
        "fr": "Rechercher et synthétiser dans un corpus autorisé."
      },
      "evaluation_focus": [
        "retrieval_coverage",
        "groundedness",
        "citation_validity",
        "corpus_freshness",
        "access_control"
      ],
      "threat_focus": [
        "corpus_poisoning",
        "indirect_prompt_injection",
        "cross_tenant_leakage",
        "stale_index"
      ]
    },
    {
      "use_pattern_id": "classification",
      "name": {
        "en": "Extraction and classification",
        "fr": "Extraction et classification"
      },
      "task": {
        "en": "Extract fields, label, route, or detect a known category.",
        "fr": "Extraire des champs, classer, router ou détecter une catégorie connue."
      },
      "evaluation_focus": [
        "per_class_precision_recall",
        "critical_false_positive_negative",
        "abstention",
        "subgroup_results",
        "drift"
      ],
      "threat_focus": [
        "evasion",
        "data_or_label_poisoning",
        "class_imbalance",
        "threshold_manipulation"
      ]
    },
    {
      "use_pattern_id": "prediction",
      "name": {
        "en": "Prediction and recommendation",
        "fr": "Prédiction et recommandation"
      },
      "task": {
        "en": "Estimate an outcome, score, rank, or recommended action.",
        "fr": "Estimer un résultat, score, rang ou action recommandée."
      },
      "evaluation_focus": [
        "calibration",
        "threshold_utility",
        "false_positive_negative_cost",
        "subgroup_results",
        "feedback_loops"
      ],
      "threat_focus": [
        "automation_bias",
        "proxy_discrimination",
        "model_extraction",
        "drift",
        "self_reinforcing_feedback"
      ]
    },
    {
      "use_pattern_id": "conversation",
      "name": {
        "en": "Conversation",
        "fr": "Conversation"
      },
      "task": {
        "en": "Maintain a multi-turn interaction with an internal or external user.",
        "fr": "Maintenir une interaction en plusieurs tours avec une personne interne ou externe."
      },
      "evaluation_focus": [
        "ai_disclosure",
        "task_completion",
        "human_handoff",
        "multi_turn_consistency",
        "retention_deletion"
      ],
      "threat_focus": [
        "impersonation",
        "multi_turn_manipulation",
        "memory_retention",
        "unsafe_advice",
        "failed_handoff"
      ]
    },
    {
      "use_pattern_id": "multimodal",
      "name": {
        "en": "Multimodal",
        "fr": "Multimodal"
      },
      "task": {
        "en": "Interpret or generate image, audio, video, speech, or sensor content.",
        "fr": "Interpréter ou générer image, audio, vidéo, parole ou contenu de capteur."
      },
      "evaluation_focus": [
        "consent_and_rights",
        "modality_quality",
        "content_provenance",
        "transformation_robustness",
        "accessibility"
      ],
      "threat_focus": [
        "deepfake",
        "voice_or_identity_misuse",
        "hidden_multimodal_instruction",
        "metadata_stripping"
      ]
    },
    {
      "use_pattern_id": "agentic",
      "name": {
        "en": "Agentic action",
        "fr": "Action agentique"
      },
      "task": {
        "en": "Plan steps, call tools, change systems, or coordinate agents.",
        "fr": "Planifier, appeler des outils, modifier des systèmes ou coordonner des agents."
      },
      "evaluation_focus": [
        "plan_and_tool_correctness",
        "authorization",
        "effect_readback",
        "idempotency",
        "rollback",
        "stopping"
      ],
      "threat_focus": [
        "goal_hijack",
        "tool_misuse",
        "identity_privilege_abuse",
        "unexpected_code_execution",
        "memory_poisoning",
        "cascading_failure"
      ]
    }
  ],
  "sources": [
    {
      "source_id": "AAP-PROCESS-02",
      "title": "AI Adoption Playbook: universal process and gates",
      "publisher": "Musyg",
      "version": "0.2.2 · 2026.08",
      "status": "internal_method",
      "url": "https://github.com/Musyg/ai-adoption-playbook/blob/main/docs/universal-process.md",
      "checked_on": "2026-08-21",
      "use_boundary": {
        "en": "Direct source for playbook lifecycle, evidence, and gate mappings.",
        "fr": "Source directe des correspondances avec le cycle de vie, les preuves et les gates du playbook."
      }
    },
    {
      "source_id": "NIST-AI-100-1",
      "title": "Artificial Intelligence Risk Management Framework",
      "publisher": "NIST",
      "version": "AI RMF 1.0 · NIST AI 100-1 · 2023-01-26",
      "status": "voluntary_framework",
      "url": "https://www.nist.gov/publications/artificial-intelligence-risk-management-framework-ai-rmf-10",
      "checked_on": "2026-08-19",
      "use_boundary": {
        "en": "Thematic support for Govern, Map, Measure, and Manage; NIST states that version 1.0 is under revision.",
        "fr": "Appui thématique pour Govern, Map, Measure et Manage ; NIST indique que la version 1.0 est en révision."
      }
    },
    {
      "source_id": "NIST-AI-600-1",
      "title": "Artificial Intelligence Risk Management Framework: Generative Artificial Intelligence Profile",
      "publisher": "NIST",
      "version": "NIST AI 600-1 · 2024-07-26",
      "status": "voluntary_framework",
      "url": "https://www.nist.gov/publications/artificial-intelligence-risk-management-framework-generative-artificial-intelligence",
      "checked_on": "2026-08-19",
      "use_boundary": {
        "en": "Cross-sector GenAI risk profile; used as supporting guidance, not a mandatory control catalogue.",
        "fr": "Profil de risque GenAI intersectoriel ; utilisé comme orientation, pas comme catalogue de contrôles obligatoire."
      }
    },
    {
      "source_id": "ISO-IEC-42001-2023",
      "title": "Information technology: Artificial intelligence: Management system",
      "publisher": "ISO/IEC",
      "version": "ISO/IEC 42001:2023 · Edition 1",
      "status": "published_standard",
      "url": "https://www.iso.org/standard/42001",
      "checked_on": "2026-08-19",
      "use_boundary": {
        "en": "Management-system themes only. No clause-level mapping or proprietary standard text is reproduced.",
        "fr": "Thèmes de système de management uniquement. Aucune correspondance article par article ni reproduction du texte propriétaire."
      }
    },
    {
      "source_id": "ISO-IEC-23894-2023",
      "title": "Information technology: Artificial intelligence: Guidance on risk management",
      "publisher": "ISO/IEC",
      "version": "ISO/IEC 23894:2023 · Edition 1",
      "status": "published_standard",
      "url": "https://www.iso.org/standard/77304.html",
      "checked_on": "2026-08-19",
      "use_boundary": {
        "en": "Risk-management themes only; consult the licensed standard for normative detail.",
        "fr": "Thèmes de gestion du risque uniquement ; consulter la norme sous licence pour le détail normatif."
      }
    },
    {
      "source_id": "ISO-IEC-5338-2023",